00:00.0 Host bridge: Intel Corporation 4 Series Chipset DRAM Controller (rev 03)
	Subsystem: Gigabyte Technology Co., Ltd GA-EP45-DS5/GA-EG45M-DS2H Motherboard
	Control: I/O- Mem+ BusMaster+ SpecCycle- MemWINV- VGASnoop- ParErr- Stepping- SERR- FastB2B- DisINTx-
	Status: Cap+ 66MHz- UDF- FastB2B+ ParErr- DEVSEL=fast >TAbort- <TAbort- <MAbort+ >SERR- <PERR- INTx-
	Latency: 0
	Capabilities: <access denied>

00:01.0 PCI bridge: Intel Corporation 4 Series Chipset PCI Express Root Port (rev 03) (prog-if 00 [Normal decode])
	Control: I/O+ Mem+ BusMaster+ SpecCycle- MemWINV- VGASnoop- ParErr- Stepping- SERR- FastB2B- DisINTx-
	Status: Cap+ 66MHz- UDF- FastB2B- ParErr- DEVSEL=fast >TAbort- <TAbort- <MAbort- >SERR- <PERR- INTx-
	Latency: 0, Cache Line Size: 4 bytes
	Interrupt: pin A routed to IRQ 16
	Bus: primary=00, secondary=01, subordinate=01, sec-latency=0
	I/O behind bridge: 0000e000-0000efff
	Memory behind bridge: f8000000-fbffffff
	Prefetchable memory behind bridge: 00000000e0000000-00000000efffffff
	Secondary status: 66MHz- FastB2B- ParErr- DEVSEL=fast >TAbort- <TAbort- <MAbort- <SERR- <PERR-
	BridgeCtl: Parity- SERR- NoISA- VGA+ MAbort- >Reset- FastB2B-
		PriDiscTmr- SecDiscTmr- DiscTmrStat- DiscTmrSERREn-
	Capabilities: <access denied>
	Kernel driver in use: pcieport

00:1a.0 USB controller: Intel Corporation 82801JI (ICH10 Family) USB UHCI Controller #4 (prog-if 00 [UHCI])
	Subsystem: Gigabyte Technology Co., Ltd Motherboard
	Control: I/O+ Mem- BusMaster+ SpecCycle- MemWINV- VGASnoop- ParErr- Stepping- SERR- FastB2B- DisINTx-
	Status: Cap+ 66MHz- UDF- FastB2B+ ParErr- DEVSEL=medium >TAbort- <TAbort- <MAbort- >SERR- <PERR- INTx-
	Latency: 0
	Interrupt: pin A routed to IRQ 16
	Region 4: I/O ports at ff00 [size=32]
	Capabilities: <access denied>
	Kernel driver in use: uhci_hcd
	Kernel modules: uhci_hcd

00:1a.1 USB controller: Intel Corporation 82801JI (ICH10 Family) USB UHCI Controller #5 (prog-if 00 [UHCI])
	Subsystem: Gigabyte Technology Co., Ltd Motherboard
	Control: I/O+ Mem- BusMaster+ SpecCycle- MemWINV- VGASnoop- ParErr- Stepping- SERR- FastB2B- DisINTx-
	Status: Cap+ 66MHz- UDF- FastB2B+ ParErr- DEVSEL=medium >TAbort- <TAbort- <MAbort- >SERR- <PERR- INTx-
	Latency: 0
	Interrupt: pin B routed to IRQ 21
	Region 4: I/O ports at fe00 [size=32]
	Capabilities: <access denied>
	Kernel driver in use: uhci_hcd
	Kernel modules: uhci_hcd

00:1a.2 USB controller: Intel Corporation 82801JI (ICH10 Family) USB UHCI Controller #6 (prog-if 00 [UHCI])
	Subsystem: Gigabyte Technology Co., Ltd Motherboard
	Control: I/O+ Mem- BusMaster+ SpecCycle- MemWINV- VGASnoop- ParErr- Stepping- SERR- FastB2B- DisINTx-
	Status: Cap+ 66MHz- UDF- FastB2B+ ParErr- DEVSEL=medium >TAbort- <TAbort- <MAbort- >SERR- <PERR- INTx-
	Latency: 0
	Interrupt: pin C routed to IRQ 18
	Region 4: I/O ports at fd00 [size=32]
	Capabilities: <access denied>
	Kernel driver in use: uhci_hcd
	Kernel modules: uhci_hcd

00:1a.7 USB controller: Intel Corporation 82801JI (ICH10 Family) USB2 EHCI Controller #2 (prog-if 20 [EHCI])
	Subsystem: Gigabyte Technology Co., Ltd Motherboard
	Control: I/O- Mem+ BusMaster+ SpecCycle- MemWINV- VGASnoop- ParErr- Stepping- SERR- FastB2B- DisINTx-
	Status: Cap+ 66MHz- UDF- FastB2B+ ParErr- DEVSEL=medium >TAbort- <TAbort- <MAbort- >SERR- <PERR- INTx-
	Latency: 0
	Interrupt: pin C routed to IRQ 18
	Region 0: Memory at fdfff000 (32-bit, non-prefetchable) [size=1K]
	Capabilities: <access denied>
	Kernel driver in use: ehci-pci
	Kernel modules: ehci_pci

00:1b.0 Audio device: Intel Corporation 82801JI (ICH10 Family) HD Audio Controller
	Subsystem: Gigabyte Technology Co., Ltd GA-EP45-UD3R Motherboard
	Control: I/O- Mem+ BusMaster+ SpecCycle- MemWINV- VGASnoop- ParErr- Stepping- SERR- FastB2B- DisINTx-
	Status: Cap+ 66MHz- UDF- FastB2B- ParErr- DEVSEL=fast >TAbort- <TAbort- <MAbort- >SERR- <PERR- INTx-
	Latency: 0, Cache Line Size: 4 bytes
	Interrupt: pin A routed to IRQ 22
	Region 0: Memory at fdff8000 (64-bit, non-prefetchable) [size=16K]
	Capabilities: <access denied>
	Kernel driver in use: snd_hda_intel
	Kernel modules: snd_hda_intel

00:1c.0 PCI bridge: Intel Corporation 82801JI (ICH10 Family) PCI Express Root Port 1 (prog-if 00 [Normal decode])
	Control: I/O+ Mem+ BusMaster- SpecCycle- MemWINV- VGASnoop- ParErr- Stepping- SERR- FastB2B- DisINTx-
	Status: Cap+ 66MHz- UDF- FastB2B- ParErr- DEVSEL=fast >TAbort- <TAbort- <MAbort- >SERR- <PERR- INTx-
	Interrupt: pin A routed to IRQ 16
	Bus: primary=00, secondary=02, subordinate=02, sec-latency=0
	I/O behind bridge: 00001000-00001fff
	Memory behind bridge: f0000000-f01fffff
	Prefetchable memory behind bridge: 00000000f0200000-00000000f03fffff
	Secondary status: 66MHz- FastB2B- ParErr- DEVSEL=fast >TAbort- <TAbort- <MAbort+ <SERR- <PERR-
	BridgeCtl: Parity- SERR- NoISA- VGA- MAbort- >Reset- FastB2B-
		PriDiscTmr- SecDiscTmr- DiscTmrStat- DiscTmrSERREn-
	Capabilities: <access denied>
	Kernel driver in use: pcieport

00:1c.3 PCI bridge: Intel Corporation 82801JI (ICH10 Family) PCI Express Root Port 4 (prog-if 00 [Normal decode])
	Control: I/O+ Mem+ BusMaster+ SpecCycle- MemWINV- VGASnoop- ParErr- Stepping- SERR- FastB2B- DisINTx-
	Status: Cap+ 66MHz- UDF- FastB2B- ParErr- DEVSEL=fast >TAbort- <TAbort- <MAbort- >SERR- <PERR- INTx-
	Latency: 0, Cache Line Size: 4 bytes
	Interrupt: pin D routed to IRQ 19
	Bus: primary=00, secondary=03, subordinate=03, sec-latency=0
	I/O behind bridge: 0000d000-0000dfff
	Memory behind bridge: fde00000-fdefffff
	Prefetchable memory behind bridge: 00000000f0400000-00000000f05fffff
	Secondary status: 66MHz- FastB2B- ParErr- DEVSEL=fast >TAbort- <TAbort- <MAbort+ <SERR- <PERR-
	BridgeCtl: Parity- SERR- NoISA- VGA- MAbort- >Reset- FastB2B-
		PriDiscTmr- SecDiscTmr- DiscTmrStat- DiscTmrSERREn-
	Capabilities: <access denied>
	Kernel driver in use: pcieport

00:1c.4 PCI bridge: Intel Corporation 82801JI (ICH10 Family) PCI Express Root Port 5 (prog-if 00 [Normal decode])
	Control: I/O+ Mem+ BusMaster+ SpecCycle- MemWINV- VGASnoop- ParErr- Stepping- SERR- FastB2B- DisINTx-
	Status: Cap+ 66MHz- UDF- FastB2B- ParErr- DEVSEL=fast >TAbort- <TAbort- <MAbort- >SERR- <PERR- INTx-
	Latency: 0, Cache Line Size: 4 bytes
	Interrupt: pin A routed to IRQ 16
	Bus: primary=00, secondary=04, subordinate=04, sec-latency=0
	I/O behind bridge: 0000c000-0000cfff
	Memory behind bridge: fdc00000-fdcfffff
	Prefetchable memory behind bridge: 00000000fdb00000-00000000fdbfffff
	Secondary status: 66MHz- FastB2B- ParErr- DEVSEL=fast >TAbort- <TAbort- <MAbort- <SERR- <PERR-
	BridgeCtl: Parity- SERR- NoISA- VGA- MAbort- >Reset- FastB2B-
		PriDiscTmr- SecDiscTmr- DiscTmrStat- DiscTmrSERREn-
	Capabilities: <access denied>
	Kernel driver in use: pcieport

00:1d.0 USB controller: Intel Corporation 82801JI (ICH10 Family) USB UHCI Controller #1 (prog-if 00 [UHCI])
	Subsystem: Gigabyte Technology Co., Ltd GA-EP45-DS5 Motherboard
	Control: I/O+ Mem- BusMaster+ SpecCycle- MemWINV- VGASnoop- ParErr- Stepping- SERR- FastB2B- DisINTx-
	Status: Cap+ 66MHz- UDF- FastB2B+ ParErr- DEVSEL=medium >TAbort- <TAbort- <MAbort- >SERR- <PERR- INTx-
	Latency: 0
	Interrupt: pin A routed to IRQ 23
	Region 4: I/O ports at fc00 [size=32]
	Capabilities: <access denied>
	Kernel driver in use: uhci_hcd
	Kernel modules: uhci_hcd

00:1d.1 USB controller: Intel Corporation 82801JI (ICH10 Family) USB UHCI Controller #2 (prog-if 00 [UHCI])
	Subsystem: Gigabyte Technology Co., Ltd GA-EP45-DS5 Motherboard
	Control: I/O+ Mem- BusMaster+ SpecCycle- MemWINV- VGASnoop- ParErr- Stepping- SERR- FastB2B- DisINTx-
	Status: Cap+ 66MHz- UDF- FastB2B+ ParErr- DEVSEL=medium >TAbort- <TAbort- <MAbort- >SERR- <PERR- INTx-
	Latency: 0
	Interrupt: pin B routed to IRQ 19
	Region 4: I/O ports at fb00 [size=32]
	Capabilities: <access denied>
	Kernel driver in use: uhci_hcd
	Kernel modules: uhci_hcd

00:1d.2 USB controller: Intel Corporation 82801JI (ICH10 Family) USB UHCI Controller #3 (prog-if 00 [UHCI])
	Subsystem: Gigabyte Technology Co., Ltd GA-EP45-DS5 Motherboard
	Control: I/O+ Mem- BusMaster+ SpecCycle- MemWINV- VGASnoop- ParErr- Stepping- SERR- FastB2B- DisINTx-
	Status: Cap+ 66MHz- UDF- FastB2B+ ParErr- DEVSEL=medium >TAbort- <TAbort- <MAbort- >SERR- <PERR- INTx-
	Latency: 0
	Interrupt: pin C routed to IRQ 18
	Region 4: I/O ports at fa00 [size=32]
	Capabilities: <access denied>
	Kernel driver in use: uhci_hcd
	Kernel modules: uhci_hcd

00:1d.7 USB controller: Intel Corporation 82801JI (ICH10 Family) USB2 EHCI Controller #1 (prog-if 20 [EHCI])
	Subsystem: Gigabyte Technology Co., Ltd GA-EP45-DS5 Motherboard
	Control: I/O- Mem+ BusMaster+ SpecCycle- MemWINV- VGASnoop- ParErr- Stepping- SERR- FastB2B- DisINTx-
	Status: Cap+ 66MHz- UDF- FastB2B+ ParErr- DEVSEL=medium >TAbort- <TAbort- <MAbort- >SERR- <PERR- INTx-
	Latency: 0
	Interrupt: pin A routed to IRQ 23
	Region 0: Memory at fdffe000 (32-bit, non-prefetchable) [size=1K]
	Capabilities: <access denied>
	Kernel driver in use: ehci-pci
	Kernel modules: ehci_pci

00:1e.0 PCI bridge: Intel Corporation 82801 PCI Bridge (rev 90) (prog-if 01 [Subtractive decode])
	Control: I/O+ Mem+ BusMaster+ SpecCycle- MemWINV- VGASnoop- ParErr- Stepping- SERR- FastB2B- DisINTx-
	Status: Cap+ 66MHz- UDF- FastB2B- ParErr- DEVSEL=fast >TAbort- <TAbort- <MAbort- >SERR- <PERR- INTx-
	Latency: 0
	Bus: primary=00, secondary=05, subordinate=05, sec-latency=32
	Memory behind bridge: fdd00000-fddfffff
	Secondary status: 66MHz- FastB2B+ ParErr- DEVSEL=medium >TAbort- <TAbort- <MAbort+ <SERR- <PERR-
	BridgeCtl: Parity- SERR- NoISA- VGA- MAbort- >Reset- FastB2B-
		PriDiscTmr- SecDiscTmr- DiscTmrStat- DiscTmrSERREn-
	Capabilities: <access denied>

00:1f.0 ISA bridge: Intel Corporation 82801JIR (ICH10R) LPC Interface Controller
	Subsystem: Gigabyte Technology Co., Ltd GA-EP45-DS5 Motherboard
	Control: I/O+ Mem+ BusMaster+ SpecCycle- MemWINV- VGASnoop- ParErr- Stepping- SERR+ FastB2B- DisINTx-
	Status: Cap+ 66MHz- UDF- FastB2B- ParErr- DEVSEL=medium >TAbort- <TAbort- <MAbort- >SERR- <PERR- INTx-
	Latency: 0
	Capabilities: <access denied>
	Kernel driver in use: lpc_ich
	Kernel modules: lpc_ich

00:1f.2 SATA controller: Intel Corporation 82801JI (ICH10 Family) SATA AHCI Controller (prog-if 01 [AHCI 1.0])
	Subsystem: Gigabyte Technology Co., Ltd GA-EP45-DS5/GA-EG45M-DS2H Motherboard
	Control: I/O+ Mem+ BusMaster+ SpecCycle- MemWINV- VGASnoop- ParErr- Stepping- SERR- FastB2B- DisINTx-
	Status: Cap+ 66MHz+ UDF- FastB2B+ ParErr- DEVSEL=medium >TAbort- <TAbort- <MAbort- >SERR- <PERR- INTx-
	Latency: 0
	Interrupt: pin B routed to IRQ 19
	Region 0: I/O ports at f900 [size=8]
	Region 1: I/O ports at f800 [size=4]
	Region 2: I/O ports at f700 [size=8]
	Region 3: I/O ports at f600 [size=4]
	Region 4: I/O ports at f500 [size=32]
	Region 5: Memory at fdffd000 (32-bit, non-prefetchable) [size=2K]
	Capabilities: <access denied>
	Kernel driver in use: ahci

00:1f.3 SMBus: Intel Corporation 82801JI (ICH10 Family) SMBus Controller
	Subsystem: Gigabyte Technology Co., Ltd GA-EP45-DS5/GA-EG45M-DS2H Motherboard
	Control: I/O+ Mem+ BusMaster- SpecCycle- MemWINV- VGASnoop- ParErr- Stepping- SERR- FastB2B- DisINTx-
	Status: Cap- 66MHz- UDF- FastB2B+ ParErr- DEVSEL=medium >TAbort- <TAbort- <MAbort- >SERR- <PERR- INTx-
	Interrupt: pin C routed to IRQ 18
	Region 0: Memory at fdffc000 (64-bit, non-prefetchable) [size=256]
	Region 4: I/O ports at 0500 [size=32]
	Kernel driver in use: i801_smbus
	Kernel modules: i2c_i801

01:00.0 VGA compatible controller: NVIDIA Corporation G92 [GeForce GTS 250] (rev a2) (prog-if 00 [VGA controller])
	Subsystem: Elsa AG G92 [GeForce GTS 250]
	Control: I/O+ Mem+ BusMaster+ SpecCycle- MemWINV- VGASnoop- ParErr- Stepping- SERR- FastB2B- DisINTx-
	Status: Cap+ 66MHz- UDF- FastB2B- ParErr- DEVSEL=fast >TAbort- <TAbort- <MAbort- >SERR- <PERR- INTx-
	Latency: 0
	Interrupt: pin A routed to IRQ 16
	Region 0: Memory at fa000000 (32-bit, non-prefetchable) [size=16M]
	Region 1: Memory at e0000000 (64-bit, prefetchable) [size=256M]
	Region 3: Memory at f8000000 (64-bit, non-prefetchable) [size=32M]
	Region 5: I/O ports at ef00 [size=128]
	[virtual] Expansion ROM at 000c0000 [disabled] [size=128K]
	Capabilities: <access denied>
	Kernel driver in use: nvidia
	Kernel modules: nvidia

03:00.0 SATA controller: JMicron Technology Corp. JMB363 SATA/IDE Controller (rev 02) (prog-if 01 [AHCI 1.0])
	Subsystem: Gigabyte Technology Co., Ltd Motherboard
	Control: I/O+ Mem+ BusMaster+ SpecCycle- MemWINV- VGASnoop- ParErr- Stepping- SERR- FastB2B- DisINTx-
	Status: Cap+ 66MHz- UDF- FastB2B- ParErr- DEVSEL=fast >TAbort- <TAbort- <MAbort- >SERR- <PERR- INTx-
	Latency: 0, Cache Line Size: 4 bytes
	Interrupt: pin A routed to IRQ 19
	Region 5: Memory at fdefe000 (32-bit, non-prefetchable) [size=8K]
	Capabilities: <access denied>
	Kernel driver in use: ahci

03:00.1 IDE interface: JMicron Technology Corp. JMB363 SATA/IDE Controller (rev 02) (prog-if 85 [Master SecO PriO])
	Subsystem: Gigabyte Technology Co., Ltd Motherboard
	Control: I/O- Mem- BusMaster- SpecCycle- MemWINV- VGASnoop- ParErr- Stepping- SERR- FastB2B- DisINTx-
	Status: Cap+ 66MHz- UDF- FastB2B- ParErr- DEVSEL=fast >TAbort- <TAbort- <MAbort- >SERR- <PERR- INTx-
	Interrupt: pin B routed to IRQ 0
	Region 0: I/O ports at df00 [disabled] [size=8]
	Region 1: I/O ports at de00 [disabled] [size=4]
	Region 2: I/O ports at dd00 [disabled] [size=8]
	Region 3: I/O ports at dc00 [disabled] [size=4]
	Region 4: I/O ports at db00 [disabled] [size=16]
	Capabilities: <access denied>

04:00.0 Ethernet controller: Realtek Semiconductor Co., Ltd. RTL8111/8168/8411 PCI Express Gigabit Ethernet Controller (rev 02)
	Subsystem: Gigabyte Technology Co., Ltd Onboard Ethernet
	Control: I/O+ Mem+ BusMaster+ SpecCycle- MemWINV- VGASnoop- ParErr- Stepping- SERR- FastB2B- DisINTx-
	Status: Cap+ 66MHz- UDF- FastB2B- ParErr- DEVSEL=fast >TAbort- <TAbort- <MAbort- >SERR- <PERR- INTx-
	Latency: 0, Cache Line Size: 4 bytes
	Interrupt: pin A routed to IRQ 16
	Region 0: I/O ports at ce00 [size=256]
	Region 2: Memory at fdbff000 (64-bit, prefetchable) [size=4K]
	Region 4: Memory at fdbe0000 (64-bit, prefetchable) [size=64K]
	[virtual] Expansion ROM at fdc00000 [disabled] [size=64K]
	Capabilities: <access denied>
	Kernel driver in use: r8169
	Kernel modules: r8169

05:07.0 FireWire (IEEE 1394): Texas Instruments TSB43AB23 IEEE-1394a-2000 Controller (PHY/Link) (prog-if 10 [OHCI])
	Subsystem: Gigabyte Technology Co., Ltd Motherboard
	Control: I/O- Mem+ BusMaster+ SpecCycle- MemWINV- VGASnoop- ParErr- Stepping- SERR- FastB2B- DisINTx-
	Status: Cap+ 66MHz- UDF- FastB2B- ParErr- DEVSEL=medium >TAbort- <TAbort- <MAbort- >SERR- <PERR- INTx-
	Latency: 32 (500ns min, 1000ns max), Cache Line Size: 4 bytes
	Interrupt: pin A routed to IRQ 23
	Region 0: Memory at fddff000 (32-bit, non-prefetchable) [size=2K]
	Region 1: Memory at fddf8000 (32-bit, non-prefetchable) [size=16K]
	Capabilities: <access denied>
	Kernel driver in use: firewire_ohci
	Kernel modules: firewire_ohci

